meetingId,title,host,duration,category,date,startTime,sentiment_score,sentiment_trajectory,themes,insight_1,insight_2
01KQ4EE836687F95080D92AB,Detect Team - Sprint Planning,mike.romano@aegiscloud.com,25.6,Internal,20260205,2026-02-05T14:15:00.000Z,0.0,,,,
01KQ445B1B5B890316C9E300,Weekly Engineering Standup,ravi.gupta@aegiscloud.com,45.2,Internal,20260417,2026-04-17T17:15:00.000Z,-0.1,"The meeting began with a neutral tone as team members provided status updates, but shifted to a slightly negative sentiment when discussing the Comply v2 issues affecting customers. The conversation highlighted concerns about the potential impact on mid-to-large enterprise clients, which raised alarms. However, the team collaboratively identified solutions and established a timeline for addressing the issues, leading to a more constructive ending, albeit with lingering concerns about workload and prioritization.","Post-Mortem Follow-Up on Detect Outage, Comply v2 Report Generation Issues, Circuit Breaker Logic Review, Load Testing Suite Planning","Implement a paginated query mechanism for the SOC 2 report generation in Comply v2. This should be owned by Sofia Petrov, with support from Ravi Gupta for QA. This addresses the root cause of the timeout errors experienced by mid-to-large enterprise customers when generating reports for large datasets, ensuring scalability and reliability of report generation across all customer segments.","Develop a comprehensive load testing suite to simulate cascading failure scenarios in the Detect system, with a targeted start date of April 28th. This should be owned by Ravi Gupta and Sofia Petrov, allocating dedicated time to ensure it is completed in a two-week sprint. This recommendation directly tackles the risk of future outages by proactively identifying weaknesses in the system before they impact production."
01KQ0DFE299AC7A74E8022CA,Aegis / Redwood Clinical - ISO 27001 Preparation,kevin.obrien@aegiscloud.com,28.8,Internal,20260426,2026-04-26T13:30:00.000Z,0.0,,,,
01KQCF9872BF130D33B1B5EC,Comply v2 - Launch Day Checklist,alex.reyes@aegiscloud.com,41.6,Internal,20260404,2026-04-04T16:45:00.000Z,0.9,"The meeting started with excitement and anticipation for the upcoming launch, with team members expressing eagerness and positivity. As they reviewed the launch checklist, they encountered minor issues but quickly resolved them, leading to a strong sense of alignment and confidence in their preparations. By the end, the team was highly optimistic about the launch, feeling well-prepared and enthusiastic, indicating a successful and productive meeting.","Comply v2 Launch Preparation, QA Sign-off and Testing, User Experience Improvements, Customer Communication Strategy","Implement a dedicated customer communication strategy for the Comply v2 launch that emphasizes the independence of its infrastructure from the recent Detect outage. This should be owned by the Marketing team, specifically Alex Reyes, who can draft an announcement that includes clarifying statements about the infrastructure. This proactive communication will help mitigate any customer concerns about stability issues and reinforce confidence in the new features of Comply v2.","Create an internal knowledge base article focused on common customer queries regarding the Comply v2 features, particularly addressing potential concerns about compliance jargon and the HIPAA reporting module's validation process. This should be owned by the Product Management team, with Nina Kowalski leading the effort. This resource will ensure that all customer-facing teams are equipped with consistent and accurate information, enhancing customer support and facilitating smoother interactions during the launch period."
01KQEDB92E33CF9945A7F71B,URGENT: Cobalt Software - Aegis Detect Dashboard Down,david.kim@aegiscloud.com,13.4,Customer Support,20260310,2026-03-10T13:15:00.000Z,-0.5,"The meeting began with Lauren expressing urgent frustration over a critical system outage, indicating a highly negative emotional state. As David provided updates and escalated the issue, there were moments of slight relief when he confirmed the engineering team was addressing the problem, but Lauren's concerns about the lack of proactive communication and the potential impact on their business kept the tone tense. Ultimately, while there was a commitment to resolve the issue and provide updates, the conversation ended with lingering dissatisfaction and a clear risk of churn, as Lauren mentioned evaluating alternatives.","Aegis Detect Dashboard Outage, Incident Response and Escalation, Customer Service Level Agreements (SLAs), Root Cause Analysis and Service Credits","Implement an automated incident detection and alerting system for the Aegis Detect dashboard that monitors the health of the event processing pipeline. This should be owned by the Engineering team. By proactively identifying issues before they impact customers and sending automated alerts to both internal teams and customers, we can significantly reduce the response time and improve customer satisfaction, addressing the root cause of the dashboard outage and communication failures.","Develop a structured post-incident review process that includes a detailed root cause analysis and a follow-up communication plan for affected clients. This process should be owned by Product Management and Account Management teams. This will ensure that customers, like Cobalt Software, receive timely updates and actionable insights on the incident, including service credit discussions, thus restoring trust and transparency while also preventing similar issues in the future."
01KQB632F1ADC378C42F2C03,Support Case #7570 - Silverline Brands Comply v2 License Upgrade,david.kim@aegiscloud.com,16.3,Customer Support,20260418,2026-04-18T09:15:00.000Z,0.5,"The meeting began with a billing discrepancy that caused initial concern for Michelle and Dominic, leading to a slightly negative tone. However, as David clarified the issue and confirmed the correct proration calculation, the mood shifted positively. By the end, the customers felt reassured with a resolution plan in place, expressing satisfaction with the support received and the functionality of the product.","Billing Discrepancy, Comply v2 License Upgrade, Proration Calculation, Credit Issuance",Implement a tiered proration calculation feature in the billing system to ensure that upgrades like Comply v2 automatically apply the correct proration based on the upgrade date rather than the start of the billing cycle. This should be owned by the Engineering team to address the root cause of the miscalculation issue observed in this call and prevent future billing discrepancies for all customers who upgrade mid-cycle.,"Create a dedicated FAQ and notification system for customers upgrading to Comply v2 that clearly outlines potential billing changes and expected timelines for credit issuance. This can be owned by Product Management, ensuring that customers like Silverline Brands have clear expectations and can maintain compliance with their internal accounting practices, thus enhancing overall customer satisfaction."
01KQF9600A904ADE8605B3F0,Detect Team - Reliability Sprint Retro,tyler.washington@aegiscloud.com,18.5,Internal,20260428,2026-04-28T10:45:00.000Z,0.8,"The meeting began with a focus on the challenges faced during the March outage, creating a slightly negative atmosphere as team members reflected on the stress of that time. However, as they discussed the successful outcomes of the reliability sprint, including improvements and teamwork, the tone shifted to highly positive. By the end, the team expressed satisfaction with their progress and a desire for future reliability-focused sprints, indicating a strong sense of accomplishment and optimism moving forward.","Reliability Sprint Retrospective, Circuit Breaker Implementation, Monitoring Gaps in Event Ingestion Pipeline, Knowledge Sharing and Documentation","Implement a dedicated monitoring dashboard for the event ingestion pipeline that includes real-time visibility into queue depth, node throughput, circuit breaker state, and latency percentiles (p95, p99). This dashboard should be owned by Tyler Washington and developed in the next sprint. This solves the root cause of the March outage, where insufficient monitoring led to a lack of visibility into pipeline health, thereby preventing proactive incident management.","Establish a quarterly reliability-focused sprint cycle that allows teams to concentrate on reliability improvements without the distraction of feature work. This initiative should be championed by Chris Lee and communicated to leadership for approval. This addresses the team's feedback regarding the clarity and focus of the recent sprint, ensuring that future reliability challenges can be tackled in a structured manner."
01KQ46A9DE0AECB006D897A0,Detect Outage - Escalation Bridge,tyler.washington@aegiscloud.com,17.1,Internal,20260311,2026-03-11T11:00:00.000Z,-0.4,"The meeting began with a sense of urgency and frustration as Diana expressed her concerns over the service outage affecting customers. As Tyler provided updates on the situation, the tone shifted to a more collaborative approach, with the team discussing immediate next steps and communication strategies. However, the overall sentiment remained negative due to the severity of the incident and the potential impact on customer relationships, leaving a lingering concern about customer retention.","Service Outage, Incident Response, Customer Communication, Redundancy Architecture","Implement a multi-node redundancy architecture for the ingestion layer of the Detect module. This should be owned by the Engineering team to ensure that the new architecture is resilient against single points of failure. By distributing the load across multiple nodes, we can prevent cascading failures and maintain service continuity, addressing the root cause of the current outage and enhancing our SLA commitments to enterprise customers.","Establish a structured incident response protocol that includes a dedicated incident commander role for major outages. This role should be owned by Product Management, with clear guidelines for customer communication during incidents. This will ensure that all stakeholders are aligned on messaging and status updates, preventing confusion and maintaining customer trust, as demonstrated by the current issues with communication during the outage."
01KQCA6EA8B603EBB6C9FE34,Aegis / Ridgeline Logistics - Identity Roadmap Discussion,daniel.okafor@aegiscloud.com,28.6,External Customer,20260307,2026-03-07T09:00:00.000Z,0.3,"The meeting began with a neutral tone as both parties expressed appreciation for each other's time. Paula raised concerns about session management and MFA policies, which introduced a slightly negative sentiment due to unresolved support issues. However, Daniel's proactive approach in addressing these concerns and offering to escalate the support ticket shifted the tone to a more positive outlook, ending with a collaborative spirit and a focus on future enhancements.","Identity Roadmap, Session Management Improvements, MFA Policy Exceptions, SSO Integration Compatibility","Implement granular session timeout policies and shared workstation session management enhancements. The Product Management team should prioritize this feature to allow configuration of session timeouts based on device type or location, and ensure proper session termination protocols are in place. This addresses the operational bottleneck highlighted by Paula regarding residual access and session management issues, which currently lead to security risks for shared terminals in the warehouse.",Develop a conditional MFA policy exception framework with an audit trail feature. The Product Management team should prioritize this enhancement to allow specific service accounts and automated processes to bypass MFA requirements while maintaining compliance through documentation. This directly responds to Paula's concern about the operational overhead caused by the binary MFA enforcement and would improve workflow efficiency without compromising security.
01KQ7B802912366FC0A24D4F,All Hands - April Update,ravi.gupta@aegiscloud.com,48.8,Internal,20260426,2026-04-26T11:45:00.000Z,0.3,"The meeting began with a focus on addressing the recent outage, which initially created a tone of concern and accountability among team members. As they discussed the successful launch of Comply v2 and the positive early adoption metrics, the mood shifted to a more optimistic outlook. However, the conversation about prioritizing reliability over new features indicated a cautious approach moving forward, balancing the need for progress with the team's recent challenges.","March Detect Outage Retrospective, Comply v2 Launch and Adoption, Q2 Planning and Roadmap Prioritization, Chaos Engineering and Reliability Improvements","To address the single point of failure in the ingestion layer that led to the March Detect outage, implement a fully automated chaos engineering framework within the Detect module. This should include real-time simulations of node failures in the production environment, ensuring immediate failover to redundant nodes without manual intervention. Engineering should own this initiative, as it will enhance system reliability and customer confidence by validating the robustness of the ingestion process under stress.","Enhance customer visibility during incidents by developing a 'status dashboard' feature within the Detect module that provides real-time updates on system health and alert statuses. This feature should be prioritized in the Q2 roadmap to prevent future escalations and improve customer communication during outages. Product Management should lead this effort to ensure it meets customer needs and aligns with the overall product vision, ultimately reducing churn and improving satisfaction."
01KQ2B4878EC7B3EE5547007,Aegis / Stratos Cloud - Audit Preparation,daniel.okafor@aegiscloud.com,23.3,Internal,20260306,2026-03-06T13:30:00.000Z,0.0,,,,
01KQBBF753B44DE677670E6D,Support Case #6147 - Summit Trust Detect Alert Delays,david.kim@aegiscloud.com,16.7,Customer Support,20260415,2026-04-15T12:30:00.000Z,-0.3,"The meeting began with Alicia and Gregory expressing significant frustration over delayed threat alerts, which they attributed to a lack of communication regarding a previous outage. As David provided insights into the technical issues and proposed a solution, the tone shifted towards a more collaborative problem-solving approach. By the end, while there was still concern over the communication failure, the discussion concluded with a clear action plan, leaving the situation somewhat resolved but with lingering dissatisfaction regarding the prior lack of notification.","Alert Delay Troubleshooting, Incident Communication Failure, Tenant Processing Node Imbalance, Regulatory Compliance Concerns","Implement a real-time alert communication protocol that integrates with Aegis Detect. The Account Management team should own this initiative, ensuring that all primary contacts for high-risk sectors, like financial services, receive timely notifications during any platform outages or significant incidents. This will address the root cause of the communication failure highlighted in the meeting, ensuring that customers are informed of issues that could impact their compliance obligations.","Develop a dynamic tenant distribution algorithm for Aegis Detect's processing nodes. The Engineering team should lead this effort to ensure that tenant workloads are balanced effectively, preventing any single node from becoming overloaded. This algorithm would automatically redistribute tenants based on current processing loads and alert frequencies, thereby mitigating the latency issues experienced by Summit Trust and enhancing overall system responsiveness."
01KQDD5172176D02DB51360A,Support Case #3286 - Vanta Health Systems API Integration Error,priya.patel@aegiscloud.com,21.0,Customer Support,20260203,2026-02-03T10:00:00.000Z,-0.3,"The meeting began with Dr. Cheng expressing significant frustration over a critical API issue affecting their backup workflows, indicating a serious concern for patient data integrity. As Priya Patel provided clarity on the situation and proposed immediate solutions, the tone shifted slightly towards a more constructive dialogue, though underlying tension remained due to the communication failures experienced. By the end, while some immediate actions were agreed upon, Dr. Cheng's frustration about the lack of proactive communication and the urgency of the situation highlighted ongoing concerns, leaving a slight negative sentiment overall.","API Integration Error, Backup Workflow Disruption, Service Availability Issues, Compliance and Data Integrity","Implement a dedicated incident alerting system for high-impact customers like healthcare organizations. This system should proactively notify affected clients about service disruptions, including expected resolution timelines and mitigation steps. Ownership should be on the Product Management team to develop this feature, enhancing customer trust and satisfaction by preventing frustration due to lack of communication during critical outages.","Introduce a manual backup override feature within the Aegis Protect web console, allowing users to trigger backups even when the orchestration layer is down. This feature should be owned by the Engineering team, addressing immediate customer needs and ensuring compliance with regulatory standards, while also enhancing the overall reliability and user experience of the backup functionality."
01KQ9772B2348F500FB09D1E,Support Case #3677 - Coastal Living Co MFA Token Failures,elena.vasquez@aegiscloud.com,13.9,Customer Support,20260224,2026-02-24T16:45:00.000Z,0.0,,"MFA Token Failures, TOTP Validation Issues, Okta SSO Integration, P1 Escalation",,
01KQ25D8AED944B5D2A9FF60,Support Case #1514 - Meridian Capital Granular Restore Request,sarah.chen@aegiscloud.com,19.3,Customer Support,20260326,2026-03-26T14:00:00.000Z,-0.1,"The meeting began with Jason expressing frustration over the limitations of the Aegis Protect product, specifically regarding the inability to perform granular restores of files. As Sarah acknowledged the shortcomings and documented Jason's feature requests, the tone shifted towards a more constructive dialogue. By the end, while Jason's immediate issue was resolved, he remained concerned about the potential for future operational challenges, indicating a slight negative sentiment overall.","Granular File-Level Restore, Feature Request Documentation, EBS Snapshot Management, Operational Recovery Time Objectives (RTO)","Implement a granular file-level restore feature within Aegis Protect specifically for EBS-backed EC2 workloads. This feature should enable users to browse snapshot contents, select specific files or directories for restoration, and also allow restoration to an alternate location to validate before overwriting. This recommendation should be owned by the Product Management team to prioritize the development based on the operational recovery needs expressed by enterprise clients like Meridian, ultimately reducing their RTO from two hours to the desired fifteen minutes.","Develop an automated telemetry system that tracks and analyzes customer support requests related to file-level restores and EBS snapshot management. This system should categorize requests by frequency and urgency, allowing the Engineering team to identify pain points and prioritize enhancements more effectively. By analyzing data on customer workarounds, such as the manual process described by Jason, Aegis Cloud can proactively address feature gaps and improve overall product usability."
01KQAC572C34475A8791F2C3,Protect Team - Quarterly Planning,mike.romano@aegiscloud.com,30.8,Internal,20260223,2026-02-23T12:45:00.000Z,0.7,"The meeting started with a focus on improving the planning process after a chaotic previous quarter, which set a slightly anxious tone. However, as the team discussed specific improvements, particularly around backup performance and restore UX, excitement and positivity grew, especially with the proposal of a new intuitive restore wizard. By the end, the team felt productive and aligned, with a clear plan moving forward, indicating strong collaboration and optimism for the upcoming quarter.","Quarterly Planning, Incremental Backup Performance, Restore UX Improvements, Multi-Region Replication","Implement a streamlined restore wizard that allows users to search for files or directories directly from the first step, reducing the current multi-step restore process. This initiative should be owned by Sofia Petrov, with collaboration from Ravi Gupta to ensure backend support for frequent index updates. This addresses the root cause of user frustration and support tickets related to the clunky restore UX, enhancing customer satisfaction and retention.","Prioritize the architectural groundwork for multi-region replication in Q2, specifically by leveraging the improvements made in incremental backup performance. Ananya Sharma should prepare a technical brief outlining how the Q2 enhancements will facilitate the Q3 multi-region rollout. This strategic move will set realistic expectations for the enterprise sales team, ensuring that customer demands are met while maintaining development focus."
01KQC1267BEB344076DD7656,Aegis / Ironclad Financial - Account Recovery Check-in,maria.santos@aegiscloud.com,35.3,External Customer,20260328,2026-03-28T12:30:00.000Z,-0.2,"The meeting began with a clear expression of frustration from Robert regarding a significant outage, setting a negative tone. However, as Maria and Kevin provided detailed explanations and solutions, the conversation shifted towards a more constructive dialogue, with Tanya engaging positively about upcoming features. By the end, while concerns about the renewal remained, there was a sense of collaborative problem-solving, indicating a slight improvement in sentiment but still leaving unresolved issues that could impact future decisions.","Platform Outage Impact, Contract Renewal Discussion, Technical Documentation Requests, Configuration Review for Detect","Implement a dedicated, self-service configuration wizard for Detect that guides customers through recommended settings, including alert persistence and offline buffering. This tool should be owned by the Product Management team, as it directly addresses the onboarding gap that Tanya highlighted during the outage, ensuring that customers are adequately prepared to leverage the platform's capabilities and avoid similar issues in the future.","Create a formal incident post-mortem template that includes clear SLA terms and a robust documentation process for outages. This should be spearheaded by the Account Management team in collaboration with Engineering. By proactively providing this documentation to clients like Robert, it not only addresses their immediate concerns regarding the March outage but also reinforces Aegis Cloud's commitment to transparency and reliability in high-stakes environments such as financial services."
01KQ1267C6AA7D9B3125FEC8,SOC 2 Audit Preparation - Internal,tyler.washington@aegiscloud.com,36.9,Internal,20260226,2026-02-26T10:15:00.000Z,0.1,"The meeting began with a sense of urgency and concern regarding the upcoming SOC 2 Type II audit, which created a slightly negative atmosphere as team members acknowledged the tight timeline and existing gaps in processes. As the discussion progressed, solutions were proposed, particularly around tightening change management processes and addressing integration issues, which shifted the tone towards a more collaborative and proactive stance. By the end, while challenges remained, the team had outlined clear action items, leaving them with a sense of direction but still facing significant work ahead.","SOC 2 Audit Preparation, Access Control Management, Change Management Process, Vendor Compliance Documentation","Implement a CI/CD pipeline gate that mandates a formal ticket reference for all production deployments. This should be owned by Ravi Gupta in the Engineering team. This recommendation addresses the identified gap in the change management process, where hotfixes were deployed without proper documentation, risking compliance issues during the SOC 2 audit.","Establish an automated integration check between Zendesk and PagerDuty to ensure all incidents have a corresponding ticket and to minimize manual workarounds. This should be managed by Mike Romano in the Engineering team. This solution targets the integration failure that leads to incomplete incident tracking, which is crucial for demonstrating compliance during the audit."
