meetingId,title,host,duration,category,date,startTime,sentiment_score,sentiment_trajectory,themes,insight_1,insight_2
01KQ56D878454E5783DC6D94,Support Case #3536 - Stratos Cloud LogVault Integration Timeout,david.kim@aegiscloud.com,12.8,Customer Support,20260422,2026-04-22T12:30:00.000Z,-0.3,"The meeting began with Damien expressing urgency and frustration over a significant issue affecting their operations, indicating a negative emotional state. As the conversation progressed, David and Priya identified the root cause of the problem, which was linked to a previous fix, leading to further frustration from Damien. However, the discussion shifted positively when a solution was proposed, including a backfill of missed data and a configuration change to prevent future issues. Despite the resolution steps, the lingering concern over repeated disruptions left the overall sentiment slightly negative.","LogVault Integration Timeout, Circuit Breaker Implementation, Event Processing Volume, Data Backfill Options","Implement a tailored circuit breaker threshold adjustment specifically for Stratos Cloud's Aegis Detect tenant. This should be owned by the Engineering team, focusing on enhancing the outbound connector's resilience to the high event processing volume. By customizing the threshold, we can prevent the circuit breaker from tripping unnecessarily, ensuring consistent data flow to LogVault and mitigating future disruptions.","Transition Stratos Cloud's LogVault integration to a streaming mode instead of the current batched push configuration. This change should be managed by Product Management, who will oversee the implementation to ensure it can handle their event volume efficiently. Streaming will distribute the load more evenly, preventing timeout issues and enhancing the reliability of data transmission, which is critical for their security monitoring."
01KQ85D10E82A26A8F754FB8,Aegis / Bridgeport Health - Compliance Review,maria.santos@aegiscloud.com,33.4,External Customer,20260213,2026-02-13T11:00:00.000Z,0.6,"The meeting began with a positive tone as both parties expressed eagerness to collaborate, but it quickly revealed significant pain points regarding compliance processes, leading to a slight dip in sentiment. However, as Kevin introduced upcoming features in Comply v2 that directly addressed these concerns, the mood shifted to excitement and relief, culminating in a productive discussion about next steps and a preview session, leaving the customer feeling optimistic about future improvements.","HIPAA Compliance Challenges, SOC 2 and HIPAA Framework Overlap, Aegis Comply v2 Features, Audit Preparation Strategies","Implement a unified evidence collection framework within Aegis Comply that allows for cross-framework mapping between SOC 2 and HIPAA controls. This initiative should be spearheaded by the Product Management team to enhance the Comply v2 features. By streamlining the evidence collection process and reducing the manual effort involved, this will directly address Evelyn's team's pain points and improve audit preparedness ahead of their upcoming HIPAA audit.","Develop a targeted compliance reporting feature that enables on-demand reporting for audits and board presentations. This feature should be led by the Engineering team and focus on integrating existing evidence libraries with customizable reporting templates. This will alleviate the burden of manual report generation and ensure that the compliance team can present timely and accurate information, ultimately saving them time and resources as they prepare for the upcoming audit."
01KQ56786DD1E8A1BF174FDD,Support Case #1993 - Forge Industries Comply v2 Early Access Question,david.kim@aegiscloud.com,25.6,Customer Support,20260403,2026-04-03T15:30:00.000Z,0.8,"The meeting began with a positive tone as all participants were able to connect clearly, and Elena's introduction set a collaborative atmosphere. As Dana expressed concerns about manual reporting for compliance, the tone shifted to excitement when Elena confirmed that Comply v2 would be released in just four days, addressing their needs effectively. The conversation ended on a high note with clear next steps and a willingness to explore additional feature requests, indicating strong customer satisfaction and a productive partnership.","Comply v2 Early Access, On-Demand Reporting for Compliance, Multi-Framework Support, Feature Request for Custom Control Labeling","Implement a dedicated 'On-Demand Reporting Configuration' feature within the Comply v2 module. This feature should include an intuitive setup wizard that assists users like Forge Industries in mapping existing controls to the new framework templates while providing context-sensitive help and real-time validation checks. This will significantly reduce manual setup time and errors, ensuring customers are fully prepared for compliance audits across multiple frameworks.","Establish a Customer Feature Request Portal within the Aegis Cloud ecosystem, specifically targeting the needs of enterprise clients like Forge Industries who require advanced customization options such as custom control labeling. This portal should allow clients to submit, track, and vote on feature requests, which can provide valuable insights to the Product Management team while fostering a community-driven approach to feature development."
01KQ4529010F423FD9DB40BD,Win/Loss Analysis - Q1,kevin.obrien@aegiscloud.com,16.5,Internal,20260424,2026-04-24T12:45:00.000Z,-0.3,"The meeting began with a tone of concern as the team discussed troubling Q1 win-loss data, particularly related to a significant outage. As they identified specific issues and proposed actionable solutions, there was a slight shift towards a more constructive atmosphere, especially with the acknowledgment of potential improvements in their product and processes. However, the overall sentiment remained slightly negative due to the lingering impact of the outage and execution gaps, leaving the team with unresolved challenges as they headed into Q2.","Q1 Win/Loss Analysis, Reliability Perception from March Outage, Competitive Positioning Against VaultEdge, Loss Note Quality Improvement","Develop a comprehensive competitive benchmarking report specifically addressing VaultEdge's RTO claims versus Aegis Cloud's strengths in total recovery workflows. This should be owned by Brian Cho, leveraging his informal research. This report will provide sales teams with concrete data to counter VaultEdge's aggressive positioning and allow for more confident and informed conversations during negotiations.","Implement a structured loss note template in Salesforce that mandates a minimum character count and specific fields for competitors and reasons for loss. Raj Kapoor should lead this initiative by collaborating with the VP of Sales. This will enhance the quality of loss notes, ensuring that the sales team captures detailed insights, which can be systematically analyzed to identify patterns and inform future strategies."
01KQ45F6F7349D0A620571F1,Aegis / Brightpath Commerce - Competitive Evaluation,aisha.johnson@aegiscloud.com,21.0,External Customer,20260422,2026-04-22T15:30:00.000Z,-0.2,"The meeting began with Kendra expressing frustration over a recent outage that severely impacted their operations, leading to a low confidence in Aegis Detect. Aisha acknowledged the issue and proposed a technical session to address concerns, which shifted the tone towards a more collaborative approach. By the end, while Kendra remained cautious and emphasized the need for concrete solutions, there was a willingness to engage further, indicating a slight improvement in sentiment but still reflecting underlying concerns.","Vendor Evaluation, Aegis Detect Performance Issues, Contract Renewal Timeline, Technical Session Planning","Implement a customized alert configuration workshop for Brightpath, led by Aegis Detect's engineering team. This session should focus on real-time adjustments to the alert tuning based on Brightpath's specific operational context, demonstrating the effectiveness of the adaptive thresholding feature. Ownership should be with the Aegis Detect product team, ensuring that they directly address the alert fatigue issue and rebuild trust with Kendra's team by showing tangible improvements.","Propose a dedicated follow-up plan that includes a pilot phase for the new redundancy features implemented in Aegis Detect. During this phase, Aegis should offer Brightpath a discounted rate or extended trial period for the Detect module while they evaluate performance improvements. This will be managed by the Account Management team, aimed at solidifying the customer relationship and providing a clear path to regain confidence in the product before the July contract renewal."
01KQ3C837D7EF689408DCF95,Support Case #2638 - Pineridge Systems CloudPrime S3 Backup Connector,priya.patel@aegiscloud.com,19.1,Internal,20260304,2026-03-04T10:15:00.000Z,0.0,,,,
01KQ5F364545B542671FF9CE,Support Case #3546 - Meridian Capital SCIM Provisioning Request,sarah.chen@aegiscloud.com,21.3,Customer Support,20260307,2026-03-07T13:30:00.000Z,0.4,"The meeting began with a clear identification of the challenges faced by Meridian Capital regarding their identity infrastructure, leading to a slightly negative tone due to compliance concerns. However, as Sarah and Marcus provided potential solutions, particularly the API approach, the tone shifted to a more positive outlook, with Jason expressing appreciation for the clarity and actionable next steps. The conversation ended on a constructive note, with a commitment to follow up on the feature request and roadmap discussions, indicating a productive engagement.","SCIM Provisioning Request, Automated User Provisioning, Compliance and Deprovisioning Controls, API Integration Options","Implement a dedicated SCIM 2.0 integration feature for Aegis Identity, prioritizing it based on the regulatory needs expressed by Meridian Capital and similar clients in the financial services sector. Product Management should take ownership of this initiative, as it addresses the critical gap in automated provisioning and deprovisioning controls that is becoming increasingly necessary for compliance. This will not only enhance customer satisfaction but also position Aegis Cloud as a more competitive player in the IAM market.","Develop a comprehensive, self-service resource on the Aegis Cloud Developer Portal specifically for API integration with Okta, including detailed guides, best practices, and example workflows for SCIM provisioning via REST API. This should be managed by the Engineering team, leveraging the existing documentation and community knowledge. Providing these resources will empower clients like Meridian Capital to implement interim solutions effectively while awaiting the full SCIM integration, thereby reducing operational bottlenecks in user management."
01KQC166F678CBA584AAFF8B,Support Case #7615 - Crestline Wealth Group Policy Sync Delay,sarah.chen@aegiscloud.com,20.7,Customer Support,20260427,2026-04-27T10:15:00.000Z,-0.3,"The meeting began with Derek expressing frustration over delays in policy syncs, indicating a negative emotional state due to operational impacts on his financial services firm. As Sarah acknowledged the issue and proposed immediate actions, including escalating the case and changing the configuration to alleviate the problem, Derek's tone shifted slightly towards a more constructive engagement. However, lingering concerns about the root cause and the previous lack of communication kept the overall sentiment slightly negative, reflecting a need for resolution and assurance.","Policy Sync Delay, Provisioning Issues, Customer Support Escalation, Configuration Changes","Implement a dedicated sync worker tier for customers with large Active Directory environments (like Derek's with 800 users) to alleviate provisioning delays. This should be owned by the Engineering team to make necessary backend adjustments, as it directly addresses the bottleneck caused by shared cluster resource limitations, ensuring faster policy and provisioning updates critical in compliance-heavy sectors like financial services.","Establish an automated notification system within the support ticketing framework to provide customers with real-time updates on the status of their high-priority cases. Account Management should lead this initiative, as it addresses customer frustration with perceived communication gaps and enhances customer trust by ensuring they are informed throughout the resolution process."
01KQ38C4101D6774F2F02331,INCIDENT: Detect Pipeline Failure - War Room,brian.cho@aegiscloud.com,29.9,Internal,20260310,2026-03-10T13:15:00.000Z,-0.4,"The meeting began with a sense of urgency and frustration due to a significant technical failure affecting customer service. As the team discussed the issues, there were moments of accountability and recognition of systemic problems, which slightly alleviated the tension. However, the overall sentiment remained negative due to ongoing customer escalations and the potential for significant data loss, leaving the team with a challenging path ahead.","Pipeline Failure, Technical Incident Response, Customer Communication Strategy, Data Loss Management","Implement a dual-node ingestion architecture with automatic failover capabilities. This should be owned by the Engineering team and can be prioritized immediately to prevent future pipeline failures like the one experienced. This change addresses the root cause of the OOM errors and single point of failure in the current setup, ensuring that a backup node can seamlessly take over and maintain throughput during incidents.","Develop a real-time customer communication protocol that includes a pre-approved template for common incident responses. This should be owned by the Product Management team and rolled out as part of the customer communication strategy. By having these templates ready, the team can provide timely and accurate updates during incidents, reducing customer anxiety and preventing escalations, as seen with Harmon Financial and TerraLogix during the recent outage."
01KQ4D504CE09A8F6ECA1F5A,Product Sync - Identity Roadmap,ananya.sharma@aegiscloud.com,39.4,Internal,20260209,2026-02-09T17:30:00.000Z,0.0,,,,
01KQ7BF0D56037FF89DC89B6,Support Case #3266 - Trailhead Marketplace Detect Alerts Not Firing,elena.vasquez@aegiscloud.com,10.0,Customer Support,20260311,2026-03-11T17:45:00.000Z,-0.6,"The meeting began with Isaac expressing significant frustration over a critical failure in the Aegis Detect system, which left him feeling blindsided and concerned about potential security risks. As the conversation progressed, Elena and David acknowledged the severity of the issue and committed to escalating the case, which provided some reassurance, but the overall tone remained tense and unresolved. By the end, while there was a promise of follow-up and prioritization, Isaac's threat to reconsider their contract indicated a high churn risk, leaving the situation precarious.","Detect Alerts Failure, Platform-Wide Issue, Customer Communication Breakdown, Incident Reporting Request","Implement a dedicated incident communication protocol for platform-wide issues that includes automated notifications via email and SMS to affected customers. The Product Management team should own this initiative to ensure that customers like Trailhead Marketplace receive timely updates during critical incidents, addressing the root cause of the communication breakdown observed in the meeting.","Enhance the event processing architecture of Aegis Detect to incorporate real-time telemetry and health checks that can proactively flag issues in the ingestion layer. The Engineering team should prioritize this architectural improvement to prevent cascading failures and ensure that customers maintain visibility over their threat monitoring, effectively solving the underlying issue of alert failures."
01KQ3D8C1EF16C042F31FAFD,Aegis / Trailhead Marketplace - Renewal Confirmation,rachel.torres@aegiscloud.com,46.6,Internal,20260405,2026-04-05T14:30:00.000Z,0.0,,,,
01KQ65D43540846FA994B6C4,Aegis / Frostbyte AI - Product Feedback,rachel.torres@aegiscloud.com,39.4,External Customer,20260425,2026-04-25T14:45:00.000Z,0.3,"The meeting began with a neutral tone, as Victor expressed satisfaction with the initial integration of Aegis Identity. However, as the discussion shifted to the challenges faced with role management and compliance audits, a slight concern emerged regarding the limitations of the current system. By the end of the call, the sentiment improved slightly as Victor clarified that he was not considering alternatives, indicating a willingness to work with Aegis Identity on resolving these issues, which left the conversation on a constructive note.","Role Management at Scale, Session Timeout Policies, Compliance Audit Challenges, Product Feedback and Feature Requests","Implement a hierarchical role management feature in Aegis Identity. Product Management should prioritize this enhancement to enable nested role inheritance, which will alleviate the manual duplication of permissions and simplify the access review process during compliance audits. This improvement will address Victor's concerns about managing a growing user base and the complexity of their role taxonomy, ultimately enhancing the user experience and compliance reporting.",Develop role-based and resource-based session timeout policies in Aegis Identity. Engineering should focus on creating a feature that allows for granular control of session timeouts based on user roles or specific resources. This will address Victor's need for tailored security measures for sensitive environments while maintaining user convenience for less critical access. Implementing this feature will help Frostbyte better align security practices with their operational requirements.
01KQ1DCC80852AE384C898C9,Aegis / Quantum Edge - Renewal Concerns,maria.santos@aegiscloud.com,45.0,Internal,20260319,2026-03-19T16:00:00.000Z,0.0,,,,
01KQ410FB7E434BA3F99EE7D,Aegis / Axiom Labs - Multi-Year Renewal,aisha.johnson@aegiscloud.com,48.8,External Customer,20260417,2026-04-17T09:45:00.000Z,0.5,"The meeting began with a positive tone as the participants expressed appreciation for each other's presence and acknowledged the improvements in the platform. However, the conversation shifted to a more serious note when the March outage was discussed, revealing some frustration but also recognition of the effective communication during the incident. The tone lightened again as they discussed the new features of Comply v2 and the renewal structure, ultimately leading to a slightly positive sentiment as they addressed concerns about growth and API access, indicating a willingness to continue the partnership.","Multi-Year Contract Renewal, Customer Satisfaction and Feedback, API Access and Integrations, Service Outage and Communication","Implement an elastic API access model that allows customers to customize their API rate limits based on their specific needs. This should be owned by the Engineering team to develop and the Product Management team to market. By addressing the rate limit issues that Mina raised, this will enhance customer satisfaction and prevent potential churn, particularly for clients experiencing rapid growth and custom tooling needs.","Develop a proactive communication strategy for service outages that includes real-time notifications and post-incident analysis accessible through the Aegis Cloud dashboard. This should be led by the Account Management team in collaboration with Engineering. By ensuring that clients can access detailed outage reports and real-time updates, Aegis Cloud will solidify trust and transparency with customers, addressing concerns raised during the meeting about the recent service outage."
01KQ1DE954A807A5D2653175,Comply v2 - Launch Readiness Review,megan.lawson@aegiscloud.com,39.3,Internal,20260324,2026-03-24T14:45:00.000Z,0.0,,,,
01KQA0F0BE68E74D66EB4171,Competitive Response Strategy,james.mitchell@aegiscloud.com,34.3,Internal,20260410,2026-04-10T11:30:00.000Z,-0.1,"The meeting began with a sense of concern regarding competitive pressure from SentinelShield, particularly due to past outages. As the team discussed technical improvements and strategies to address customer concerns, the tone shifted towards a more collaborative and proactive approach, especially with the introduction of Comply v2 as a differentiator. By the end, while there was still some apprehension about the competitive landscape, the team left with actionable plans and a sense of cautious optimism about their positioning.","Competitive Positioning Against SentinelShield, Technical Remediation from March Outage, Comply v2 Differentiation, Action Items for Customer Engagement","Develop a competitive positioning framework specifically addressing the reliability concerns raised by SentinelShield, which should include a one-pager outlining the March remediation and the architectural improvements made. This document should be owned by Tom Bradley and be ready for distribution to the sales team. By providing a clear narrative on the technical upgrades, we can build trust with prospects and counteract any negative perceptions stemming from the outage.","Create a targeted engagement strategy for Hartfield Manufacturing that leverages their current SOC 2 audit status. This should involve a technical call with Kevin O'Brien to demonstrate the on-demand SOC 2 reporting capabilities of Comply v2. Rachel Torres should lead this initiative, as it directly addresses a critical pain point for the prospect and showcases our unique value proposition, differentiating Aegis Cloud from competitors who lack integrated compliance solutions."
01KQ325BDEDEE927D2970775,Support Case #5889 - Ridgeline Logistics Detect Latency Issues,priya.patel@aegiscloud.com,11.4,Customer Support,20260314,2026-03-14T17:15:00.000Z,-0.3,"The meeting began with Paula expressing frustration over significant delays in threat alerts from Aegis Detect, which she deemed unacceptable for their operations. Priya acknowledged the issue and provided transparency about a cascading failure on Aegis's side, which shifted the tone to a more constructive dialogue as they discussed resolution steps. By the end, while Paula remained concerned about the implications of the incident, she appreciated Priya's honesty and commitment to follow up, indicating a slight improvement in sentiment but still reflecting a serious concern about service reliability.","Latency Issues in Aegis Detect, Event Processing Pipeline Failure, Customer Communication and SLA Breach, Escalation Path for Support","Implement an automated alert system for Aegis Detect that notifies affected customers about significant latency issues or failures in real-time. This system should be owned by the Engineering team and integrated into the event processing pipeline. By proactively communicating potential issues, it prevents customer teams from spending unnecessary time troubleshooting and ensures they can take immediate action if needed, thus addressing the root cause of the communication breakdown experienced by Paula's team.","Establish a clear escalation protocol for high-severity incidents involving Aegis Detect, including a dedicated support line and direct access to on-call engineers. This should be managed by Account Management, ensuring that account managers are trained to facilitate immediate escalation for critical issues. This recommendation addresses the customer’s need for a rapid response during emergencies, thereby improving customer confidence and satisfaction in Aegis Cloud's support capabilities."
01KQ764171AC27A3A94DC695,Detect Reliability - 30-Day Review,tyler.washington@aegiscloud.com,45.8,Internal,20260407,2026-04-07T13:45:00.000Z,0.3,"The meeting began with a focus on the technical issues stemming from the Detect outage, creating a slightly negative atmosphere due to the previous incident's impact on customers. As the team discussed the fixes implemented and the positive outcomes since then, the tone shifted to a more collaborative and slightly positive sentiment, especially when exploring ways to improve customer relations and leverage new features. By the end, while there were still concerns about specific customer relationships, the team left with actionable steps and a sense of proactive engagement.","Post-Incident Review, Technical Outage Analysis, Customer Impact Assessment, Action Items for Customer Success","Implement a proactive customer notification system that triggers alerts to Customer Success whenever the circuit breaker activates. This system should automatically send a message detailing the incident and resolution to key account contacts. Ownership should lie with the Engineering team, specifically Chris, to develop and integrate this feature. This addresses the root cause of Diana being caught off guard during customer inquiries and enhances transparency with clients during technical disruptions.","Develop a beta program for the expanded event telemetry dashboard and include Meridian Financial as an early access participant. This initiative should be spearheaded by Chris, in collaboration with product management, to ensure that the dashboard is ready for demonstration by mid-May. This recommendation directly addresses the customer impact from the previous outage by providing enhanced visibility and may help rebuild trust with Meridian ahead of their renewal."
