meetingId,title,host,duration,category,date,startTime,sentiment_score,sentiment_trajectory,themes,insight_1,insight_2
01KQB3B16F255B65F39597D0,Comply v2 - Design Review,hannah.liu@aegiscloud.com,31.8,Internal,20260212,2026-02-12T13:45:00.000Z,0.7,"The meeting started with a focus on design review and addressing open questions, initially creating a neutral atmosphere. As Ananya presented solid solutions for report generation latency and the control mapping layer, the tone shifted positively, with team members expressing relief and satisfaction. By the end, the team felt confident about the April launch date, indicating a productive session with resolved concerns and a clear path forward.","Comply v2 Design Review, On-Demand Reporting Architecture, Multi-Framework Support, Performance Testing Plan","Implement a performance testing simulation that not only checks concurrent report generation but also incorporates a monitoring dashboard for real-time visibility into system health during peak loads. This should be owned by the Engineering team to ensure proper load testing is done before GA, addressing Mike's concern about system stability under simultaneous report requests.","Develop a streamlined self-service portal for customers that allows them to request specific report types and track their status, leveraging the async report generation model. This should be owned by Product Management to enhance user experience and reduce support inquiries, directly addressing customer needs highlighted in the meeting regarding report generation latency."
01KQ8C5A044F54EE1774D53C,Aegis / Helix Data - Post-Incident Review,maria.santos@aegiscloud.com,35.8,External Customer,20260317,2026-03-17T11:45:00.000Z,-0.3,"The meeting began with Charles expressing frustration over a significant outage that left his team without threat monitoring for six hours, which set a negative tone. As Kevin explained the technical fixes and acknowledged the shortcomings, there was a slight shift towards a more constructive dialogue, but Charles remained concerned about the underlying issues and the impact on their vendor review process. By the end, while there was a plan for follow-up actions, Charles's skepticism about the platform's reliability indicated unresolved issues, leaving a lingering risk of churn.","Incident Response, Alerting Mechanisms, Service Reliability, Customer Confidence","Implement an automated self-monitoring and alerting mechanism within Aegis Detect that triggers alerts on internal failures before they affect customer visibility. This should be owned by the Engineering team, focusing on developing telemetry that monitors the health of the event ingestion pipeline. This will ensure that your customers, like Helix, receive immediate notifications about internal issues, improving their confidence in Aegis Cloud's reliability.","Create a customizable, user-friendly interface for rule configuration within Aegis Detect to reduce the burden of false positives for clients. This should be led by Product Management, who will conduct user research to understand specific pain points and develop a streamlined process. By addressing the cumbersome nature of current custom rule setups, you can significantly enhance user experience and retention for customers like Helix who are considering alternatives."
01KQ351E141926AB7CAB668D,Aegis / Northstar Pharma - Urgent: Detect Outage Impact,maria.santos@aegiscloud.com,48.1,Customer Support,20260312,2026-03-12T12:15:00.000Z,-0.4,"The meeting began with Grace expressing frustration over a significant outage that left her team without visibility into their security monitoring, indicating a highly negative emotional state. As Maria acknowledged the issues and proposed concrete remediation steps, including a call with the VP of Engineering and a commitment to a detailed incident report, the tone shifted slightly towards a more constructive dialogue. However, Grace remained concerned and skeptical about the reliability of the service, reflecting a slightly negative sentiment by the end, as she emphasized the urgency of her needs before the upcoming renewal.","Outage Impact Analysis, Event Processing Failure, SLA Review and Commitment, Regulatory Compliance Concerns","Implement an automated alerting system that triggers notifications to both customers and internal teams when event processing failures occur, ensuring immediate awareness and transparency. This should be owned by the Engineering team, with collaboration from Product Management to define the alert criteria and escalation paths. This solution addresses the root cause of the lack of visibility during outages, providing customers like Northstar with real-time updates and reducing anxiety during critical periods.","Revise the current SLA structure for enterprise customers to include explicit commitments around uptime, incident response times, and penalties for non-compliance. This should be led by the Account Management team in partnership with Product Management to ensure the SLA meets the compliance needs of regulated industries like healthcare. This recommendation directly addresses Grace's concerns about regulatory exposure and builds confidence in Aegis Cloud's commitment to service reliability."
01KQ45C76AF3AEA6B3EA6697,Aegis / Steelpoint Manufacturing - Contract Review,daniel.okafor@aegiscloud.com,34.6,External Customer,20260324,2026-03-24T17:45:00.000Z,-0.2,"The meeting began with a neutral tone, but quickly shifted to a slightly negative sentiment as Harold raised concerns about a recent outage that severely impacted his team's operations. As Sofia provided technical details and reassurances about improvements made, the tone improved slightly, but Harold's need for solid justifications for renewal pricing and product capabilities kept the conversation cautious. By the end, while there was a willingness to continue the partnership, the unresolved issues and need for written commitments left a lingering concern about the relationship's stability.","Contract Renewal Terms, Service Level Agreement (SLA) Enhancements, CMMC Compliance Roadmap, Customer Relationship Management","Implement a dedicated CMMC Compliance Support Module within the Comply product that includes a detailed project timeline and resources for customers undergoing audits, ensuring real-time updates on the roadmap. This should be owned by Product Management to enhance customer confidence and address specific gaps identified by Harold, making it easier for him to justify continued partnership with Aegis Cloud to his leadership.","Create a tiered SLA framework that allows customers to opt for different levels of service based on their specific operational needs and risk appetite. This should be owned by Engineering and Product Management, enabling more customized service options for customers like Harold, who may be balancing cost with the need for higher reliability in mission-critical environments."
01KQ45C0AD36B351A3571940,Aegis / Silverline Brands - Comply v2 Early Access Demo,kevin.obrien@aegiscloud.com,50.3,External Customer,20260403,2026-04-03T15:15:00.000Z,0.8,"The meeting began with a positive tone as both parties expressed satisfaction with the connection and acknowledged the busy quarter. As the demo progressed, Dominic's initial concerns about compliance reporting transformed into excitement upon seeing the new features of Comply v2, particularly the on-demand reporting and gap analysis capabilities. By the end of the conversation, Dominic was enthusiastic about the upcoming release and its potential to significantly improve their compliance processes, indicating a strong alignment and positive momentum for the partnership.","Comply v2 Product Demo, PCI DSS Compliance Reporting, On-Demand Reporting Features, Integration with Aegis Detect","Implement a tailored onboarding and training program specifically for the Comply v2 on-demand reporting features, led by the Account Management team. This program should focus on educating Silverline's compliance and audit teams on how to utilize the new reporting engine effectively, including practical sessions on generating PCI DSS reports and interpreting gap analyses. This addresses the root cause of slow evidence turnaround during audits and empowers Silverline to take full advantage of the new capabilities, ultimately leading to improved compliance management.","Develop a real-time alert system within the Aegis Comply platform that notifies users when compliance control statuses change due to events detected by Aegis Detect. The Engineering team should own this initiative. This will help Silverline proactively manage compliance gaps as they arise, rather than reacting to them after the fact. This recommendation directly addresses the customer's need for dynamic compliance management, especially in a fast-paced retail environment where transaction conditions are constantly changing."
01KQ92EA85FE4C537400227D,Support Case #8811 - Blackridge Investments Custom Compliance Template,priya.patel@aegiscloud.com,9.3,Customer Support,20260425,2026-04-25T17:15:00.000Z,0.7,"The meeting began with a positive tone as Warren expressed excitement about the new features in Aegis Comply, particularly the on-demand reporting. As they discussed the feature request for custom compliance templates, Warren's initial concern about the lack of this feature shifted to optimism when Priya confirmed it was on the near-term roadmap and offered to log the request formally. The conversation ended on a highly positive note, with Warren feeling satisfied and appreciative of the productive support call, indicating a strong partnership and potential for future collaboration.","Custom Compliance Templates, Feature Request, Aegis Comply v2, API Integration","Develop a Custom Compliance Template Builder within Aegis Comply v2. This feature should allow enterprise customers like Blackridge to define their own control categories and evidence requirements. Product Management should own this initiative as it addresses the specific need for tailored compliance reporting, ensuring customers can meet unique regulatory demands without waiting for a generalized feature release.","Enhance API capabilities to allow for flexible data exports that include custom annotations and control categories. The Engineering team should prioritize this by creating an endpoint that supports custom data structures, enabling clients like Blackridge to integrate compliance data directly into their internal reporting tools. This addresses the immediate need for operational workarounds while paving the way for future enhancements with custom templates."
01KQ4D71CDFB1045A2458216,Aegis / Bridgeport Health - Renewal Finalization,james.mitchell@aegiscloud.com,39.5,Internal,20260423,2026-04-23T13:30:00.000Z,0.0,,,,
01KQ9BB82FD97C9607D57E90,Aegis / Coastal Living Co - Onboarding Kickoff,maria.santos@aegiscloud.com,30.8,External Customer,20260204,2026-02-04T11:00:00.000Z,0.8,"The meeting began with a positive tone as both parties expressed excitement about finally connecting and the potential of Aegis Protect. As they discussed the onboarding process and the capabilities of the solution, Vanessa's concerns about recovery times and fragmentation were alleviated, leading to a more enthusiastic outlook. By the end, both Maria and Vanessa were aligned on next steps, with Vanessa expressing eagerness for the implementation, indicating a strong partnership and high customer satisfaction.","Onboarding Process, Backup and Recovery Solutions, Retention Policies, Compliance Requirements","Implement a customized onboarding timeline that includes a dedicated onboarding checklist for Coastal Living, detailing the steps, resources, and timelines specific to their infrastructure setup, including their hybrid environment. This should be owned by the Product Management team to ensure clarity in the onboarding process. This recommendation addresses the customer’s concerns about fragmentation and competing priorities by providing a tailored approach that keeps them aligned with their operational requirements.",Develop a feature within Aegis Protect that allows users to set and manage retention policies based on compliance requirements directly from the dashboard. This should be owned by the Engineering team and would allow Coastal Living to easily configure their data retention settings according to PCI DSS and other regulatory needs. This solution alleviates their compliance concerns by giving them granular control and visibility over their data management practices.
01KQ7F58A2E07B857C24624D,Competitive Landscape Review,jordan.whitfield@aegiscloud.com,20.2,Internal,20260219,2026-02-19T09:15:00.000Z,0.3,"The meeting began with a neutral tone as Jordan and Tom discussed the competitive landscape, acknowledging the need for a more structured approach. As they delved into specific competitors, the conversation shifted to a slightly negative sentiment when discussing the shortcomings of their product compared to SentinelShield, highlighting a perception gap. However, the tone improved towards the end as they agreed on actionable next steps and expressed appreciation for each other's contributions, leaving the meeting with a collaborative spirit and a plan to address the identified risks.","Competitive Analysis, SentinelShield Threat, VaultEdge Compliance Features, CyberNova Pricing Strategy","Prioritize a streamlined configuration experience for the LogVault connector in the Detect module. Product Management should take ownership to enhance the user interface and reduce manual steps, addressing the perception gap highlighted in competitive comparisons with SentinelShield. By simplifying the setup process to match their three-click integration, Aegis Cloud can better compete and improve customer satisfaction.","Accelerate the development of on-demand compliance reporting features in the Comply module to preempt VaultEdge's market positioning. Product Management should collaborate with Engineering to ensure these features are prioritized in the roadmap. By delivering robust compliance capabilities ahead of competitors, Aegis Cloud can strengthen its market position and capture potential customers concerned about compliance reporting."
01KQ5AFAE8264DDC0ED2AE7F,Aegis / Crestline Wealth - Identity Module Deployment,rachel.torres@aegiscloud.com,35.7,Internal,20260424,2026-04-24T16:45:00.000Z,0.0,,,,
01KQ9BCA1794C9472726FFAD,Comply v2 - Adoption Metrics Review,jordan.whitfield@aegiscloud.com,30.9,Internal,20260422,2026-04-22T14:45:00.000Z,0.8,"The meeting began with a positive vibe check, reflecting optimism about the Comply v2 launch, especially after previous challenges. As the team discussed adoption rates and customer feedback, the tone shifted to excitement, particularly when discussing upsell opportunities and positive customer testimonials. The meeting concluded on a high note, with a strong sense of validation for their efforts and a clear path forward, indicating strong team morale and customer satisfaction.","Comply v2 Adoption Metrics, Customer Feedback on Reporting UI, ISO 27001 Formatting Issue, Future Roadmap for GDPR Integration","Implement a dedicated feedback loop for the ISO 27001 formatting issue by creating a user feedback portal within the Comply v2 reporting UI. This would allow customers to directly submit formatting concerns or suggestions, which would be owned by the Product Management team. This proactive approach addresses the root cause of customer dissatisfaction regarding control numbering discrepancies, ensuring that similar issues are identified and resolved swiftly in the future.","Accelerate the integration of GDPR into the Comply v2 framework list by allocating additional engineering resources to this initiative. This should be driven by the Engineering team, with direct collaboration from Product Management to align on prioritization. Given the positive adoption metrics and the expressed demand from European customers, fast-tracking GDPR implementation will capitalize on the momentum generated by Comply v2 and enhance customer satisfaction and retention."
01KQA7DFCE1285F52192B34B,Support Case #9856 - Silverline Brands Backup Window Exceeded,david.kim@aegiscloud.com,28.4,Customer Support,20260412,2026-04-12T09:00:00.000Z,-0.3,"The meeting began with Dominic expressing frustration over ongoing backup issues that have persisted for two weeks, impacting their operations. David acknowledged the problem and took ownership of the delayed response, which slightly alleviated Dominic's concerns. However, as they delved deeper into the root cause, Dominic's alarm grew when he learned that a separate incident might have affected their backups without prior notification. The conversation ended with a plan for escalation and a follow-up, but the unresolved nature of the issue left a lingering sense of concern about the reliability of the service.","Backup Window Exceeded, SQL Server Backup Performance, Throughput Issues, Incident Response and Escalation","Implement a proactive notification system for customers regarding backend infrastructure changes that could impact services, particularly around backup operations. This should be owned by the Product Management team, ensuring that customers like Silverline Brands are informed ahead of time to prevent operational disruptions. This addresses the root cause of customer frustration over lack of communication about the incident affecting their backups.","Develop a tiered backup performance optimization feature within Aegis Protect that allows customers to customize their backup windows and prioritize critical SQL Server backups to avoid performance degradation during business hours. This feature should be owned by the Engineering team, as it provides a concrete solution to the throughput issues while allowing customers to adjust settings based on their specific operational needs."
01KQAFB8DBF6E1E2FDEF0B75,Aegis / Maplewood Goods - SOC 2 Prep Review,aisha.johnson@aegiscloud.com,22.4,External Customer,20260227,2026-02-27T14:45:00.000Z,0.7,"The meeting began with a positive tone as Nathan expressed excitement about the call, indicating a proactive approach to their SOC 2 preparation. As the discussion progressed, Nathan revealed challenges with their current manual processes, which introduced a slight concern. However, the introduction of Aegis Comply's features, particularly the upcoming v2 launch, shifted the tone to highly positive as Nathan recognized the potential for significant time savings and efficiency improvements. The meeting concluded with Nathan expressing strong interest in moving forward, indicating a resolved and optimistic outlook for their compliance efforts.","SOC 2 Compliance Preparation, Evidence Collection Process, Onboarding and Integration Support, Continuous Compliance Across Frameworks","{'recommendation': ""Develop a tailored onboarding program that includes a detailed integration roadmap for retail clients like Maplewood. The Account Management team should create a structured plan with estimated timelines, key milestones, and dedicated technical support resources to guide clients through the initial setup. This will alleviate Nathan's concerns about resource allocation and time investment, ensuring his team understands the process and can effectively manage their compliance workload while minimizing disruption.""}",
01KQ298F2846EFE59B0D70E2,Competitive Threat Assessment - Post Outage,megan.lawson@aegiscloud.com,26.2,Internal,20260320,2026-03-20T15:30:00.000Z,-0.4,"The meeting began with a clear sense of frustration and concern regarding a recent outage that significantly impacted customer trust and competitive positioning. As the team discussed the implications and potential responses, there were moments of constructive dialogue, particularly around transparency and proactive communication strategies. However, the overall sentiment remained slightly negative due to the ongoing challenges and the pressure to regain customer confidence, leaving the team with unresolved issues and a cautious outlook.","Post-Outage Analysis, Competitive Threats, Customer Communication Strategy, Product Roadmap Alignment","Implement a structured post-mortem report generation tool that automatically compiles outage details, impact assessments, and remediation actions taken. This tool should be owned by the Engineering team to ensure it captures technical specifics, while the Account Management team can leverage these reports in customer conversations to demonstrate transparency and proactive risk management. This directly addresses the request for detailed impact reports from customers and can help rebuild trust by showing that Aegis Cloud is taking the outage seriously and learning from it.","Develop a competitive battlecard update process that includes a clear narrative on how Aegis Cloud's architecture has been enhanced post-outage, alongside the upcoming Comply v2 launch. This should be owned by Product Management and Marketing, ensuring that sales representatives like Daniel and James have current, relevant information to counter competitor narratives effectively. This recommendation addresses the need for a cohesive counter-narrative in competitive conversations, allowing the sales team to highlight Aegis Cloud's commitment to reliability and ongoing product improvements."
01KQFFC0F889AE8CFEE7A00D,Aegis / Blackridge Investments - Renewal Discussion,aisha.johnson@aegiscloud.com,54.1,External Customer,20260207,2026-02-07T17:45:00.000Z,0.7,"The meeting began with a positive tone as Julia expressed happiness with the platform's performance, particularly highlighting the success of Aegis Protect during a disaster recovery exercise. This positivity was reinforced by Aisha and Ananya's affirmations of Julia's experiences. However, a slight dip occurred when Ananya addressed a past processing issue, but Julia's understanding and appreciation for the transparency helped to stabilize the conversation. The mood shifted back to excitement as they discussed the upcoming Aegis Comply v2 features, with Julia expressing eagerness to participate in a beta program, ultimately leading to a strong sense of partnership and commitment towards the renewal discussion.","Contract Renewal Terms, Platform Performance Review, Upcoming Features in Aegis Comply, Client Feedback on Aegis Protect and Detect","Implement a dedicated onboarding program for Aegis Comply v2 for Blackridge, led by the Product Management team. This should include a customized training session that demonstrates the new on-demand compliance reporting feature and multi-framework mapping. This initiative addresses Julia's concern about underutilization of the Comply module and will empower her team to leverage the new capabilities effectively, thus improving their audit processes and overall satisfaction with Aegis Cloud.","Create a proactive communication strategy for informing customers about past incidents, specifically regarding event processing issues in Aegis Detect. This should be spearheaded by the Engineering team and involve developing an automated alert system that notifies customers of potential performance degradations and provides real-time updates during outages. By transparently addressing customer concerns and maintaining open lines of communication, this will enhance trust and demonstrate Aegis Cloud's commitment to reliability."
01KQA1AFDC1306A000B0C7D9,Aegis / Vanta Health Systems - Backup Strategy Workshop,lisa.park@aegiscloud.com,43.3,External Customer,20260228,2026-02-28T17:30:00.000Z,0.7,"The meeting began with a positive tone as Raymond expressed eagerness for the discussion, highlighting a strong desire for clarity on their backup strategy. As the conversation progressed, Raymond's initial concerns about their fragmented backup processes shifted to excitement when Aisha introduced automated recovery testing features, which directly addressed his pain points. By the end of the meeting, there was a clear sense of optimism and confidence in Aegis Protect's capabilities, indicating a productive alignment and a strong potential for partnership.","Backup Strategy Development, Hybrid Environment Management, Compliance and HIPAA Requirements, Automated Recovery Testing","Implement a tiered retention policy feature in Aegis Protect specifically tailored for healthcare compliance. This feature should allow Vanta Health to configure retention settings based on data types, ensuring that patient data backups meet varying regulatory requirements. Product Management should own this initiative as it addresses Raymond's concern about compliance complexity and mitigates the risk of non-compliance penalties.","Develop an automated recovery testing schedule that integrates with Vanta Health's existing operational calendar to allow for seamless testing of the backup and recovery process. This functionality should enable Aegis Protect to automatically schedule and execute restore tests during off-peak hours, minimizing disruption while providing the necessary validation to meet RTO and RPO objectives. Engineering should lead this effort, which will directly enhance the confidence level in their backup strategy, as indicated by Raymond's low confidence in their current testing process."
01KQ0CAE7F064EC93F0540CA,Weekly Engineering Standup,chris.lee@aegiscloud.com,29.0,Internal,20260216,2026-02-16T10:00:00.000Z,0.0,,,,
