meetingId,title,host,duration,category,date,startTime,sentiment_score,sentiment_trajectory,themes,insight_1,insight_2
01KQ51DC4345D9DAE005678C,Aegis / Redwood Clinical - Product Feedback Session,daniel.okafor@aegiscloud.com,40.3,External Customer,20260222,2026-02-22T13:15:00.000Z,0.3,"The meeting began with a neutral tone, as both parties acknowledged the relevance of the discussion. As Thomas expressed specific pain points regarding the Comply tool, the sentiment shifted slightly negative due to frustrations with reporting limitations. However, the conversation ended on a slightly positive note, with Thomas acknowledging the reliability of other products and expressing willingness to engage further, indicating a potential for resolution and continued partnership.","HIPAA Reporting Improvements, Automated Report Delivery, Executive Summary for Compliance Reports, Feature Feedback for Aegis Comply","Implement a granular filtering feature for HIPAA and SOC 2 reports within Aegis Comply, allowing users to drill down into specific control areas without exporting data. This should be owned by the Product Management team to ensure it aligns with user needs. By addressing this, we can eliminate the manual effort currently required for auditors, thereby enhancing the user experience and increasing customer satisfaction.","Develop an automated report delivery system that allows users to schedule and send compliance reports to designated stakeholders without manual intervention. This initiative should be led by the Engineering team to ensure seamless integration with existing workflows. This will reduce the operational overhead for compliance officers like Priya, ensuring timely and efficient communication of compliance status to executives, which is critical for maintaining trust and compliance."
01KQ77F2867FC54E13A8C495,Aegis / Brightpath Commerce - Detect Module Deployment,james.mitchell@aegiscloud.com,45.8,External Customer,20260211,2026-02-11T09:15:00.000Z,0.3,"The meeting began with a positive tone as both parties expressed appreciation for each other's time and discussed the deployment plan for Aegis Detect. As they delved into technical details, Kendra showed concern regarding alert fatigue and reliability issues, which introduced a slight negative shift. However, James's transparency about past issues and the robust solutions implemented helped restore confidence, leading to a slightly positive conclusion as Kendra felt reassured about the deployment timeline and integration capabilities.","Aegis Detect Deployment, Onboarding Process, Integration with PagerDuty and LogVault, Security Incident Transparency","Implement a dedicated onboarding checklist within the Aegis Cloud platform that includes specific IAM permission requirements and a streamlined process for integrating with third-party tools like PagerDuty and LogVault. This should be owned by Product Management and Engineering, as it will reduce onboarding time and complexity for new customers like Brightpath, ultimately leading to smoother deployments and higher customer satisfaction.","Create a proactive communication strategy for customers regarding past reliability issues, including regular updates on system performance and improvements made to Aegis Detect. This should be managed by Account Management and Marketing, ensuring that customers are aware of enhancements and can trust the system's reliability, thus alleviating concerns about dependency on Aegis Detect for monitoring."
01KQ2D93184912F0147315E7,URGENT: Blackridge Investments - Complete Loss of Threat Visibility,marcus.williams@aegiscloud.com,21.1,Internal,20260312,2026-03-12T15:45:00.000Z,0.0,,,,
01KQ5A966832A146DA4B7D41,Aegis / Summit Trust - Platform Concerns Discussion,maria.santos@aegiscloud.com,53.0,Internal,20260326,2026-03-26T16:00:00.000Z,0.0,,,,
01KQ41FB5CCFD9EA583FB020,Aegis / Harborview Banking - Threat Detection Tuning,kevin.obrien@aegiscloud.com,36.3,External Customer,20260305,2026-03-05T15:30:00.000Z,0.4,"The meeting began with a neutral tone as participants introduced themselves and set the agenda. As the discussion progressed, Patricia expressed concern over alert fatigue affecting her SOC team, which shifted the tone to slightly negative. However, Kevin provided actionable solutions for tuning the detection settings, leading to a more positive outlook as they discussed specific adjustments and support options. The meeting ended on a collaborative note, with a focus on addressing compliance needs and improving operational efficiency.","Threat Detection Tuning, False Positive Management, Compliance Monitoring, User Behavior Baselines","Implement a geo-anomaly trusted location profile for Harborview Banking. Kevin O'Brien should lead this initiative by configuring specific geographic regions like New York, Chicago, and Manila in the Aegis Detect platform. This will help lower the alert severity for logins from these trusted locations, significantly reducing the false positives generated by authentication anomaly alerts. This adjustment directly addresses the root cause of SOC team fatigue and compliance documentation overload.","Develop a bulk user behavior anchoring template for high-mobility users within Harborview Banking. Kevin O'Brien should create this template to allow Patricia Dunn's team to easily flag 25-30 users as high-mobility in the Detect console. This will enhance the accuracy of user behavior baselines and accelerate the learning model for these users, which will help reduce false positives over time and ensure critical alerts receive the attention they need."
01KQ560FF1570C5E7F71D752,Aegis / Coastal Living Co - Protect Module Expansion,kevin.obrien@aegiscloud.com,45.7,External Customer,20260419,2026-04-19T15:15:00.000Z,0.5,"The meeting began with a positive tone as both Kevin and Vanessa exchanged pleasantries, indicating a good rapport. Vanessa expressed concerns about their current backup setup, which shifted the tone slightly towards a more serious discussion about challenges. However, as Kevin introduced solutions that addressed her pain points, particularly the unified view and streamlined implementation process, the sentiment improved significantly, leaving Vanessa feeling reassured and optimistic about the partnership moving forward.","Backup and Recovery Solutions, Data Protection Requirements, Implementation Phases, Customer Onboarding Process","Implement a centralized dashboard feature in Aegis Protect that provides real-time visibility across all environments, including both CloudPrime and on-prem systems. This recommendation should be owned by the Product Management team as it directly addresses Vanessa's pain point of having to navigate multiple dashboards for backup visibility. By simplifying the user experience and providing a unified view, it will significantly reduce the time her team spends managing backups, especially during peak traffic periods.","Develop a tailored onboarding package that includes a phased implementation plan specifically designed for customers with legacy systems and bandwidth constraints, like Coastal Living. This should be owned by the Account Management team and include a business impact analysis template to demonstrate the cost of downtime during peak periods. By ensuring that the onboarding process is manageable and includes clear metrics for success, it will help Vanessa secure internal buy-in from her CFO and facilitate smoother adoption of Aegis Protect."
01KQ773D68723289E4A98889,Support Case #7572 - Brightpath Commerce Invoice Discrepancy,sarah.chen@aegiscloud.com,12.6,Customer Support,20260227,2026-02-27T13:00:00.000Z,0.3,"The meeting began with Kendra expressing concern over an unexpected invoice discrepancy, indicating a slightly negative emotional state. As the discussion progressed, Sarah and Marcus provided clarity on the situation, identifying the root cause as a policy change rather than intentional overuse, which alleviated some of Kendra's concerns. By the end of the call, Kendra felt reassured about the operational status and the next steps for addressing the billing issue, resulting in a slightly positive sentiment.","Invoice Discrepancy, Billing Charges, Data Retention Overage, Backup Policy Changes","Implement a self-service usage dashboard enhancement for Aegis Protect that includes real-time usage alerts and easy-to-understand metrics, specifically distinguishing between raw and compressed data sizes. This feature should be owned by the Product Management team to ensure clarity for users like Brightpath Commerce, who may inadvertently exceed their data retention tiers due to configuration changes. This addresses the root cause of customer confusion over billing charges related to usage spikes resulting from policy changes.","Establish a proactive account management protocol where account managers, like Devon Park for Brightpath Commerce, are required to conduct quarterly reviews of customer backup configurations and usage patterns. This initiative should be owned by the Account Management team, as it will help identify potential overage risks before they translate into unexpected charges. By fostering better communication and understanding of the product usage, we can prevent similar billing discrepancies from occurring in the future."
01KQ5D47170D4828E89EDE37,Support Case #7537 - Forge Industries Detect Recovery Confirmation,elena.vasquez@aegiscloud.com,27.8,Customer Support,20260318,2026-03-18T14:45:00.000Z,-0.2,"The meeting began with Dana expressing frustration over a significant outage that caused a loss of visibility for six hours, indicating a negative emotional state. As Elena provided detailed explanations about the root cause and the architectural changes made to prevent future issues, Dana's tone shifted to a more constructive and engaged demeanor, although concerns about the implications of the outage remained. By the end of the conversation, while Dana felt reassured by the confirmation of system health and the follow-up actions promised by Elena, the initial frustration over the outage left a slight negative sentiment overall.","Detect Platform Outage, Root Cause Analysis, Data Recovery Summary, Post-Incident Report","Implement a robust automated alert system for the Detect platform that notifies users in real-time about any outages or degradation in service. This should be owned by the Engineering team, as it addresses the root cause of the lack of visibility during the outage. By alerting users immediately when an issue arises, it allows them to take proactive measures rather than reactively managing the fallout of a complete service failure.",Develop a self-service portal feature that allows customers like Forge Industries to access real-time health metrics and historical data recovery summaries. This initiative should be led by Product Management to ensure users can independently verify their system's status and historical performance. This addresses the concern raised by Dana regarding the need for confirmation of tenant health and reduces reliance on support for routine inquiries.
01KQ0C1280EDA4E70AAD7C35,Support Case #9279 - Summit Trust Billing Inquiry,sarah.chen@aegiscloud.com,23.8,Internal,20260206,2026-02-06T09:15:00.000Z,0.0,,,,
01KQE110900B8A65D80AE694,Detect Outage - Root Cause Analysis,sofia.petrov@aegiscloud.com,15.9,Internal,20260314,2026-03-14T14:30:00.000Z,-0.4,"The meeting began with a sense of urgency and frustration as the team addressed a significant failure in their system, which had left customers without visibility for hours. As they discussed the technical details and acknowledged past oversights, the tone shifted from frustration to a more constructive focus on solutions, although concerns about accountability and the need for transparency remained. By the end, while the team was still grappling with the aftermath of the incident, they established clear action items and a commitment to prevent future issues, indicating a path forward despite the negative circumstances.","Cascading Failure in Event Ingestion Layer, Health Check Limitations, Circuit Breaker Implementation, Chaos Engineering Coverage","Implement a dual-node redundancy system for the event ingestion layer, focusing on active load balancing to eliminate the single point of failure. This recommendation should be owned by the Engineering team, specifically Mike, with a target completion within two to three weeks. This will directly address the cascading failure issue by ensuring that if one node fails, the other can continue processing events, thereby maintaining threat monitoring visibility for customers.","Establish a comprehensive chaos engineering framework to regularly test the resilience of the event ingestion pipeline by simulating node failures. Nina, with assistance from Tyler, should lead this initiative. By proactively testing the system under failure conditions, we can ensure that the health checks are genuinely reflective of service readiness, thus preventing future incidents where the service appears operational but is unresponsive."
01KQ6A5CEAAFFBE3B0099E75,Support Case #6539 - Steelpoint Manufacturing LDAP Sync Failures,marcus.williams@aegiscloud.com,20.9,Customer Support,20260322,2026-03-22T09:15:00.000Z,-0.2,"The meeting began with Harold expressing significant frustration over a critical LDAP sync failure that had left over 200 employees unable to access necessary systems. As Marcus took ownership of the issue and guided Harold through troubleshooting, the tone shifted towards a more collaborative problem-solving approach. However, despite identifying the root cause related to an SSL certificate, Harold remained annoyed about the delay in resolution, indicating a slight improvement in sentiment but still reflecting underlying concerns about the service reliability.","LDAP Sync Failures, SSL Certificate Issues, Active Directory Integration, Response Time Delays","Implement an enhanced error messaging system within the Aegis Identity LDAP connector that provides specific alerts for SSL certificate issues. This should include tailored error codes and messages that indicate when a certificate is untrusted, as well as guidance on how to resolve it. Ownership of this initiative should be with the Product Management team, as it addresses the root cause of customer frustration and improves the user experience by enabling faster troubleshooting.","Develop a proactive monitoring and alerting feature for LDAP sync failures that checks for common issues such as SSL certificate trust and firewall accessibility. This feature should automatically notify customers of potential problems before they impact user access. The Engineering team should own this task, as it would help mitigate operational downtime and enhance overall service reliability, especially in critical environments like manufacturing."
01KQ9A6BE09D73A9BB5798C7,Support Case #3615 - Nimbus Platform Custom Report Request,david.kim@aegiscloud.com,14.1,Customer Support,20260210,2026-02-10T15:30:00.000Z,0.3,"The meeting began with Keith expressing a specific need for a feature that Aegis Comply currently lacks, indicating some frustration with the manual workaround they have been using. As David provided clarity on the situation and assured that the feature request would be escalated, Keith's tone shifted to a more collaborative and hopeful stance, especially when discussing potential early access to new features. The conversation ended on a positive note, with both parties feeling aligned on the next steps, though the lack of a clear timeline for the requested feature still leaves some uncertainty.","Custom Reporting Request, Cross-Framework Control Mapping, Feature Escalation, Exportable Report Requirements","Develop a cross-framework reporting module within Aegis Comply that allows users to create a control mapping matrix across SOC 2, ISO 27001, and PCI DSS, showcasing the relationships between equivalent controls. This feature should be prioritized by the Product Management team given the specific request from Nimbus Platform, which highlights a critical gap in the current reporting capabilities and would significantly reduce manual effort and error for users during audit preparations.","Establish a dedicated beta program for early access to new features in Aegis Comply, specifically targeting customers like Nimbus Platform who have expressed interest in participating. This program should be managed by Account Management, with clear guidelines on how customers can provide feedback on new features, ensuring that the development team receives actionable insights that can inform product prioritization and improve overall customer satisfaction."
01KQD1270E98A7DFC55ADCF8,Protect Performance - Scalability Concerns,tyler.washington@aegiscloud.com,23.5,Internal,20260415,2026-04-15T16:45:00.000Z,-0.3,"The meeting began with a sense of urgency and concern as alarming performance issues were discussed, leading to a tense atmosphere. Nina expressed frustration over the lack of action on previously flagged issues, which heightened the discomfort among the team. However, as solutions were proposed, particularly the idea of a temporary throttle and a quicker fix for the deduplication issue, the tone shifted slightly towards a more collaborative and proactive stance, though the underlying anxiety about customer impact and credibility remained.","Scalability Concerns, Scheduler Concurrency Issues, Async Deduplication, Customer Onboarding Strategy","Implement a temporary throttling mechanism on job concurrency limits per tenant to alleviate pressure on the job scheduler while the full refactor is being developed. This should be owned by the Engineering team, specifically Tyler and Sofia, as they can quickly adjust the configuration settings to ensure stability without a complete overhaul. This addresses the immediate risk of long queue times and potential outages as new customers onboard, thus protecting Aegis Cloud's credibility with enterprise clients.","Accelerate the async deduplication prototype to decouple the deduplication check from the job execution flow. Sofia should lead this initiative, working closely with Tyler to prototype and test the async worker solution. This quick win, estimated at one to two weeks, will help reduce blocking I/O during backup jobs, improving throughput and mitigating the cascading effects on the job scheduler, which directly addresses the core issues identified in the meeting."
01KQ31ED026F745FE2A55CCD,Identity Team - Q2 Roadmap,ananya.sharma@aegiscloud.com,47.6,Internal,20260413,2026-04-13T11:45:00.000Z,0.5,"The meeting started with a positive tone as team members expressed excitement about the Q2 roadmap, particularly following the successful Comply v2 launch. However, concerns about existing issues with JIT provisioning and SCIM were raised, reflecting a slight dip in morale due to past outages. The conversation shifted back to a positive trajectory as the team collaboratively discussed solutions and innovative features, ultimately ending on a hopeful note with a clear plan for moving forward.","Q2 Roadmap Planning, Just-in-Time Provisioning Improvements, Adaptive MFA Policies, Identity Audit Trail Integration","Develop a comprehensive attribute mapping UI for Just-in-Time (JIT) provisioning, led by Jordan Whitfield and Mike Romano. This should include a drag-and-drop interface with inline validation to prevent configuration errors before saving. This addresses the root cause of high support ticket volumes related to SSO configuration and JIT provisioning, improving user experience and reducing operational bottlenecks.","Implement a phased rollout of adaptive MFA policies, starting with context-aware signals like login location and device posture, led by Sofia Petrov. This should include an initial beta version for customer feedback before full deployment. By enhancing security measures and differentiating Aegis Cloud from competitors like SentinelShield, this initiative can directly respond to customer demands and improve competitive positioning in enterprise deals."
01KQ1DC6CA536DE1B31ED8F5,Aegis / Atlas Precision - Contract Discussion,rachel.torres@aegiscloud.com,33.5,Internal,20260225,2026-02-25T15:00:00.000Z,0.0,,,,
01KQ5EC1665DCFD7A6B62A59,Support Case #8749 - Coastal Living Co SAML Certificate Rotation Bug,marcus.williams@aegiscloud.com,10.1,Customer Support,20260329,2026-03-29T15:15:00.000Z,-0.4,"The meeting began with Vanessa expressing significant frustration over a critical issue affecting a large portion of her workforce, leading to a tense atmosphere. As the conversation progressed, the team identified a bug in the certificate rotation wizard, which Vanessa found unacceptable given their reliance on the platform. However, the tone shifted slightly towards resolution when a manual workaround was proposed, and the support team committed to follow-up actions, though the underlying dissatisfaction remained evident, indicating a risk of churn if issues persist.","SAML Certificate Rotation Bug, Authentication Failures, Manual Workaround for Service Provider Connections, Customer Advisory for Bug Prevention","Implement a dedicated SAML certificate management dashboard within the Aegis Identity module, allowing users to monitor and manage their certificate statuses in real-time. Product Management should own this initiative, as it directly addresses the root cause of authentication failures due to certificate rotation issues, providing customers with proactive alerts and insights to avoid similar disruptions in the future.","Develop an automated certificate propagation feature that ensures new SAML certificates are instantly and correctly updated across all service provider connections upon rotation. This recommendation should be led by the Engineering team, as it will eliminate manual intervention and reduce the risk of human error during critical updates, ultimately enhancing the reliability of SSO functionalities for customers like Vanessa Cruz's organization."
01KQA502E222E2A60330237B,Aegis / Pineridge Systems - Q1 Business Review,kevin.obrien@aegiscloud.com,41.5,External Customer,20260303,2026-03-03T15:15:00.000Z,0.6,"The meeting began with a positive tone as Yuki expressed satisfaction with the Aegis platform, highlighting significant improvements in threat monitoring and recovery tests. A key emotional shift occurred when Yuki learned about the upcoming on-demand SOC 2 reporting feature, which excited him and changed his perspective on the renewal, making it a more concrete ROI discussion. By the end, Yuki was optimistic about renewing, indicating a strong partnership and a willingness to discuss pricing, which suggests a productive outcome.","Q1 Business Review, Renewal Discussion, Aegis Detect Feedback, Aegis Comply v2 Updates","Develop a comprehensive tiered restore playbook specifically tailored for Pineridge's database architecture. This should be owned by Ananya in collaboration with Yuki's team. By addressing the confusion around restore sequencing, this playbook will enhance operational efficiency during DR drills and reduce manual intervention, leading to smoother recovery processes.","Create a detailed cost-benefit analysis and time savings report for Pineridge, focusing on the transition to Aegis Comply v2 for SOC 2 reporting. This should be owned by Daniel, utilizing a pre-existing template customized for Pineridge's specific use case. This analysis will provide Yuki with concrete data to justify the renewal and budget allocation, directly impacting the customer's perception of ROI."
01KQ68FB3E9E60C4477CDAB4,Comply v2 - GA Deployment Plan,ananya.sharma@aegiscloud.com,29.5,Internal,20260401,2026-04-01T17:45:00.000Z,0.8,"The meeting started with a positive tone as team members expressed excitement about the upcoming GA deployment of Comply v2. Key emotional shifts occurred when concerns about potential issues were addressed constructively, particularly regarding the reporting service's performance and redundancy measures. The meeting concluded on a high note, with team members feeling proud and optimistic about the deployment, indicating strong alignment and readiness for the launch.","GA Deployment Plan, Infrastructure Changes, Testing and QA, Rollback Strategy","Implement a concurrent request monitoring dashboard for the on-demand report generation feature. This dashboard should provide real-time metrics on latency and queue depth, specifically targeting the p99 latency during peak concurrent requests. Ownership should lie with Nina Kowalski in QA, working alongside Ravi Gupta in Engineering to integrate this into MetricFlow. This addresses the identified risk of latency creeping up during concurrent report generation, ensuring that any issues can be detected and resolved proactively before they impact customers.","Establish a post-launch review protocol focused on the performance of the new reporting service, particularly around the two-week window following the GA release. This should include gathering feedback from initial tier-one customers on their experience, as well as analyzing the performance metrics collected from the concurrent request monitoring dashboard. Ownership should rest with Ananya Sharma in Product Management, with support from Nina and Ravi to compile data and insights. This will help identify any necessary adjustments or enhancements early in the lifecycle of the new feature, reducing the likelihood of customer complaints and improving service reliability."
